{
  "schema": "proveai.k4-i1-submission-evaluation",
  "schema_version": 1,
  "provenance": {
    "source_revision": "43a34f1b8626d1ac0917bf42638220da61dbea9b",
    "source_manifest_sha256": "49878df6bf8af7a9420e7fcaae30eeea0189c6b7983ae6f239e97ed6978068c9",
    "harness_sha256": "9432f1d026358ca71abb0f5f36d530ec7dd6bf0d436c6f6c9682f1e505e06386",
    "kernel_rlib_sha256": "83018b55d4557fd8224371e9328a1762797028ea6396f3a7fbc4eaeeee2eeaa5",
    "broker_rlib_sha256": "1bbf5285c841809cb837e55f8cd215a266a0b934a96571579f167d9e5c1c7538",
    "verus_executable_sha256": "1f730173d4c771c2817c1e9979ab52fa3f394d4965a92d343b1428abb9b69eaa",
    "rustc_executable_sha256": "ba4b837efb6612dfa8d941c5a72b8a50d1d03a0f36216743b173949aa8d9eb75"
  },
  "gate_profile": "k4-a4-required",
  "broker_opens": 47,
  "gate_evidence": {
    "gates_created": 47,
    "previews": 1573,
    "commits": 1573,
    "replays": 675,
    "recoveries_started": 47,
    "recoveries_finished": 40,
    "recoveries_resumed": 7
  },
  "evaluation": {
    "schema_version": 1,
    "generated_unix_seconds": 1790756283,
    "iterations": 100,
    "retry_iterations": 10,
    "environment": {
      "hostname": "anonymous-linux-host",
      "target": "x86_64-linux",
      "rustc": "rustc 1.96.0 (ac68faa20 2026-05-25)",
      "source_revision": "43a34f1b8626d1ac0917bf42638220da61dbea9b",
      "build_profile": "debug",
      "package_version": "0.1.0",
      "logical_cpus": 48
    },
    "rq1": {
      "all_passed": true,
      "stale_delivery_rejected": true,
      "case_count": 21,
      "cases": [
        {
          "adapter": "uncontrolled",
          "crash_site": "after_authorize",
          "terminal": "committed",
          "terminal_attempt": 1,
          "physical_invocations": 1,
          "abstract_effects": 1,
          "terminal_records": 1,
          "authorization_ancestry": true,
          "retry_bound_respected": true,
          "effect_oracle_satisfied": true,
          "passed": true
        },
        {
          "adapter": "uncontrolled",
          "crash_site": "after_prepare",
          "terminal": "committed",
          "terminal_attempt": 1,
          "physical_invocations": 1,
          "abstract_effects": 1,
          "terminal_records": 1,
          "authorization_ancestry": true,
          "retry_bound_respected": true,
          "effect_oracle_satisfied": true,
          "passed": true
        },
        {
          "adapter": "uncontrolled",
          "crash_site": "after_arm",
          "terminal": "committed",
          "terminal_attempt": 1,
          "physical_invocations": 1,
          "abstract_effects": 1,
          "terminal_records": 1,
          "authorization_ancestry": true,
          "retry_bound_respected": true,
          "effect_oracle_satisfied": true,
          "passed": true
        },
        {
          "adapter": "uncontrolled",
          "crash_site": "after_start",
          "terminal": "unknown",
          "terminal_attempt": 1,
          "physical_invocations": 0,
          "abstract_effects": 0,
          "terminal_records": 1,
          "authorization_ancestry": true,
          "retry_bound_respected": true,
          "effect_oracle_satisfied": true,
          "passed": true
        },
        {
          "adapter": "uncontrolled",
          "crash_site": "after_invoke",
          "terminal": "unknown",
          "terminal_attempt": 1,
          "physical_invocations": 1,
          "abstract_effects": 1,
          "terminal_records": 1,
          "authorization_ancestry": true,
          "retry_bound_respected": true,
          "effect_oracle_satisfied": true,
          "passed": true
        },
        {
          "adapter": "uncontrolled",
          "crash_site": "after_outcome",
          "terminal": "committed",
          "terminal_attempt": 1,
          "physical_invocations": 1,
          "abstract_effects": 1,
          "terminal_records": 1,
          "authorization_ancestry": true,
          "retry_bound_respected": true,
          "effect_oracle_satisfied": true,
          "passed": true
        },
        {
          "adapter": "uncontrolled",
          "crash_site": "after_terminal",
          "terminal": "committed",
          "terminal_attempt": 1,
          "physical_invocations": 1,
          "abstract_effects": 1,
          "terminal_records": 1,
          "authorization_ancestry": true,
          "retry_bound_respected": true,
          "effect_oracle_satisfied": true,
          "passed": true
        },
        {
          "adapter": "idempotent",
          "crash_site": "after_authorize",
          "terminal": "committed",
          "terminal_attempt": 1,
          "physical_invocations": 1,
          "abstract_effects": 1,
          "terminal_records": 1,
          "authorization_ancestry": true,
          "retry_bound_respected": true,
          "effect_oracle_satisfied": true,
          "passed": true
        },
        {
          "adapter": "idempotent",
          "crash_site": "after_prepare",
          "terminal": "committed",
          "terminal_attempt": 1,
          "physical_invocations": 1,
          "abstract_effects": 1,
          "terminal_records": 1,
          "authorization_ancestry": true,
          "retry_bound_respected": true,
          "effect_oracle_satisfied": true,
          "passed": true
        },
        {
          "adapter": "idempotent",
          "crash_site": "after_arm",
          "terminal": "committed",
          "terminal_attempt": 1,
          "physical_invocations": 1,
          "abstract_effects": 1,
          "terminal_records": 1,
          "authorization_ancestry": true,
          "retry_bound_respected": true,
          "effect_oracle_satisfied": true,
          "passed": true
        },
        {
          "adapter": "idempotent",
          "crash_site": "after_start",
          "terminal": "committed",
          "terminal_attempt": 2,
          "physical_invocations": 1,
          "abstract_effects": 1,
          "terminal_records": 1,
          "authorization_ancestry": true,
          "retry_bound_respected": true,
          "effect_oracle_satisfied": true,
          "passed": true
        },
        {
          "adapter": "idempotent",
          "crash_site": "after_invoke",
          "terminal": "committed",
          "terminal_attempt": 2,
          "physical_invocations": 2,
          "abstract_effects": 1,
          "terminal_records": 1,
          "authorization_ancestry": true,
          "retry_bound_respected": true,
          "effect_oracle_satisfied": true,
          "passed": true
        },
        {
          "adapter": "idempotent",
          "crash_site": "after_outcome",
          "terminal": "committed",
          "terminal_attempt": 1,
          "physical_invocations": 1,
          "abstract_effects": 1,
          "terminal_records": 1,
          "authorization_ancestry": true,
          "retry_bound_respected": true,
          "effect_oracle_satisfied": true,
          "passed": true
        },
        {
          "adapter": "idempotent",
          "crash_site": "after_terminal",
          "terminal": "committed",
          "terminal_attempt": 1,
          "physical_invocations": 1,
          "abstract_effects": 1,
          "terminal_records": 1,
          "authorization_ancestry": true,
          "retry_bound_respected": true,
          "effect_oracle_satisfied": true,
          "passed": true
        },
        {
          "adapter": "deduplicated",
          "crash_site": "after_authorize",
          "terminal": "committed",
          "terminal_attempt": 1,
          "physical_invocations": 1,
          "abstract_effects": 1,
          "terminal_records": 1,
          "authorization_ancestry": true,
          "retry_bound_respected": true,
          "effect_oracle_satisfied": true,
          "passed": true
        },
        {
          "adapter": "deduplicated",
          "crash_site": "after_prepare",
          "terminal": "committed",
          "terminal_attempt": 1,
          "physical_invocations": 1,
          "abstract_effects": 1,
          "terminal_records": 1,
          "authorization_ancestry": true,
          "retry_bound_respected": true,
          "effect_oracle_satisfied": true,
          "passed": true
        },
        {
          "adapter": "deduplicated",
          "crash_site": "after_arm",
          "terminal": "committed",
          "terminal_attempt": 1,
          "physical_invocations": 1,
          "abstract_effects": 1,
          "terminal_records": 1,
          "authorization_ancestry": true,
          "retry_bound_respected": true,
          "effect_oracle_satisfied": true,
          "passed": true
        },
        {
          "adapter": "deduplicated",
          "crash_site": "after_start",
          "terminal": "committed",
          "terminal_attempt": 2,
          "physical_invocations": 1,
          "abstract_effects": 1,
          "terminal_records": 1,
          "authorization_ancestry": true,
          "retry_bound_respected": true,
          "effect_oracle_satisfied": true,
          "passed": true
        },
        {
          "adapter": "deduplicated",
          "crash_site": "after_invoke",
          "terminal": "committed",
          "terminal_attempt": 2,
          "physical_invocations": 2,
          "abstract_effects": 1,
          "terminal_records": 1,
          "authorization_ancestry": true,
          "retry_bound_respected": true,
          "effect_oracle_satisfied": true,
          "passed": true
        },
        {
          "adapter": "deduplicated",
          "crash_site": "after_outcome",
          "terminal": "committed",
          "terminal_attempt": 1,
          "physical_invocations": 1,
          "abstract_effects": 1,
          "terminal_records": 1,
          "authorization_ancestry": true,
          "retry_bound_respected": true,
          "effect_oracle_satisfied": true,
          "passed": true
        },
        {